{
  "caseId": "bmc-synthetic-od-on-selected-f-only-path",
  "title": "Origin and destination on F; selecting F+B still complete via transfer",
  "classification": "synthetic_contract_fixture",
  "categories": [
    "borough_brooklyn",
    "borough_manhattan",
    "cross_borough",
    "lines_2",
    "od_on_selected_lines",
    "transfer",
    "station_complex"
  ],
  "origin": {
    "stationId": "st_carroll"
  },
  "destination": {
    "stationId": "st_bryant"
  },
  "timing": {
    "type": "depart_at",
    "time": "2026-07-30T14:00:00-04:00"
  },
  "selectedLineIds": [
    "F",
    "B"
  ],
  "expectedFeasibility": "complete",
  "minimumSatisfactionCount": 2,
  "expectedOriginStationId": "st_carroll",
  "expectedDestinationStationId": "st_bryant",
  "humanReviewNotes": "Synthetic: OD both served by F; preference still forces F+B complete itinerary.",
  "staticDatasetVersion": "gtfs_fixture_v1",
  "realtimeFixtureVersion": "rt_fixture_v1",
  "sut": {
    "kind": "conductor_fixture",
    "responseId": "complete-match"
  },
  "invariantAssertions": [
    "valid_itinerary_structure",
    "origin_destination_consistency",
    "chronological_legs",
    "nonnegative_durations",
    "satisfaction_accounting",
    "complete_beats_partial",
    "max_satisfaction_before_time",
    "deterministic_order",
    "max_three_itineraries",
    "honest_data_mode",
    "impossible_constraint_explanation",
    "expected_feasibility",
    "minimum_satisfaction"
  ]
}
