{
  "caseId": "bmc-recorded-baseline-carroll-bryant",
  "title": "Recorded: Carroll → Bryant baseline with empty line selection",
  "classification": "recorded_data",
  "categories": [
    "borough_brooklyn",
    "borough_manhattan",
    "cross_borough",
    "lines_0",
    "baseline_only",
    "degraded_realtime"
  ],
  "origin": { "placeId": "st:F21" },
  "destination": { "placeId": "st:D16" },
  "timing": { "type": "depart_now" },
  "selectedLineIds": [],
  "expectedFeasibility": "not_applicable",
  "minimumSatisfactionCount": 0,
  "humanReviewNotes": "Captured 2026-07-30 :8080. Empty selectedLineIds ⇒ constrained empty, baseline present. static=mta-subway-c9c3366cdd16; dataMode=stale. Not synthetic.",
  "staticDatasetVersion": "mta-subway-c9c3366cdd16",
  "realtimeFixtureVersion": "rt_live_20260730_1c24a8f3d2",
  "sut": {
    "kind": "recorded_response",
    "responseId": "recorded-baseline-carroll-bryant"
  },
  "tags": ["nyc_live_capture", "stale_mode"],
  "invariantAssertions": [
    "valid_itinerary_structure",
    "origin_destination_consistency",
    "chronological_legs",
    "nonnegative_durations",
    "satisfaction_accounting",
    "complete_beats_partial",
    "max_satisfaction_before_time",
    "deterministic_order",
    "max_three_itineraries",
    "honest_data_mode",
    "impossible_constraint_explanation",
    "expected_feasibility",
    "minimum_satisfaction"
  ]
}
