{
  "caseId": "bmc-p1-station-address",
  "title": "TODO/SKIP: Station→address preferred routing (Wave 1A+1D)",
  "classification": "pending_live_integration",
  "categories": ["borough_manhattan", "lines_1"],
  "origin": { "placeId": "st:723" },
  "destination": {
    "coordinate": { "lat": 40.7505, "lon": -73.9934 },
    "label": "Midtown west near Penn"
  },
  "timing": { "type": "depart_now" },
  "selectedLineIds": ["2"],
  "expectedFeasibility": "complete",
  "minimumSatisfactionCount": 1,
  "humanReviewNotes": "P1 matrix #4 PENDING. Station origin + geocoded address destination. Privacy-safe labels only.",
  "staticDatasetVersion": "gtfs_fixture_v1",
  "realtimeFixtureVersion": "pending_wave_1a_1d",
  "sut": { "kind": "conductor_fixture", "responseId": "complete-match" },
  "tags": ["p1_wave1e", "p1_pending", "matrix_4", "soft_feasibility", "wave_1a", "wave_1d", "privacy_safe_placeref"],
  "invariantAssertions": [
    "valid_itinerary_structure",
    "chronological_legs",
    "nonnegative_durations",
    "deterministic_order",
    "max_three_itineraries",
    "honest_data_mode"
  ]
}
