{
  "caseId": "bmc-synthetic-depart-now-request-shape",
  "title": "Depart-now request shape against complete-match fixture",
  "classification": "synthetic_contract_fixture",
  "categories": [
    "borough_brooklyn",
    "borough_manhattan",
    "cross_borough",
    "lines_2",
    "transfer"
  ],
  "origin": {
    "placeId": "pl_carroll_st"
  },
  "destination": {
    "placeId": "pl_bryant_park"
  },
  "timing": {
    "type": "depart_now"
  },
  "selectedLineIds": [
    "F",
    "B"
  ],
  "expectedFeasibility": "complete",
  "minimumSatisfactionCount": 2,
  "expectedOriginStationId": "st_carroll",
  "expectedDestinationStationId": "st_bryant",
  "humanReviewNotes": "Mirrors contracts/fixtures/routes/request-depart-now.json inputs.",
  "staticDatasetVersion": "gtfs_fixture_v1",
  "realtimeFixtureVersion": "rt_fixture_v1",
  "sut": {
    "kind": "conductor_fixture",
    "responseId": "complete-match"
  },
  "invariantAssertions": [
    "valid_itinerary_structure",
    "origin_destination_consistency",
    "chronological_legs",
    "nonnegative_durations",
    "satisfaction_accounting",
    "complete_beats_partial",
    "max_satisfaction_before_time",
    "deterministic_order",
    "max_three_itineraries",
    "honest_data_mode",
    "impossible_constraint_explanation",
    "expected_feasibility",
    "minimum_satisfaction"
  ]
}
