{
  "caseId": "bmc-pending-bronx-2-5-peak",
  "title": "LIVE: Wakefield → Bowling Green with 2+5",
  "classification": "live",
  "categories": [
    "borough_bronx",
    "borough_manhattan",
    "cross_borough",
    "peak",
    "lines_2",
    "local_express",
    "od_on_selected_lines"
  ],
  "origin": {
    "placeId": "st:201"
  },
  "destination": {
    "placeId": "st:420"
  },
  "timing": { "type": "depart_now" },
  "selectedLineIds": [
    "2",
    "5"
  ],
  "expectedFeasibility": "complete",
  "minimumSatisfactionCount": 2,
  "humanReviewNotes": "Executable live public-station case. Certified alpha produced complete 2+5 routes on the Stage C refresh; repeat determinism and satisfaction remain merge-blocking in the live subset.",
  "staticDatasetVersion": "mta-subway-live-at-gate",
  "realtimeFixtureVersion": "live_at_gate_time",
  "sut": {
    "kind": "live",
    "responseId": "live-bronx-2-5"
  },
  "tags": [
    "live_smoke",
    "stage_c"
  ],
  "invariantAssertions": [
    "valid_itinerary_structure",
    "origin_destination_consistency",
    "chronological_legs",
    "nonnegative_durations",
    "satisfaction_accounting",
    "complete_beats_partial",
    "max_satisfaction_before_time",
    "deterministic_order",
    "max_three_itineraries",
    "honest_data_mode",
    "impossible_constraint_explanation",
    "expected_feasibility",
    "minimum_satisfaction"
  ]
}
