{
  "caseId": "bmc-p1-station-station-one-pref",
  "title": "P1: Station→station with one preferred line (7 stale)",
  "classification": "synthetic_contract_fixture",
  "categories": [
    "borough_queens",
    "borough_manhattan",
    "cross_borough",
    "peak",
    "lines_1",
    "no_transfer",
    "degraded_realtime",
    "od_on_selected_lines"
  ],
  "origin": { "stationId": "st_vernon" },
  "destination": { "stationId": "st_gct" },
  "timing": { "type": "depart_now" },
  "selectedLineIds": ["7"],
  "expectedFeasibility": "complete",
  "minimumSatisfactionCount": 1,
  "expectedOriginStationId": "st_vernon",
  "expectedDestinationStationId": "st_gct",
  "humanReviewNotes": "P1 matrix #2. Single preferred line must achieve complete when feasible. Synthetic stale fixture.",
  "staticDatasetVersion": "gtfs_fixture_v1",
  "realtimeFixtureVersion": "rt_fixture_stale",
  "sut": { "kind": "conductor_fixture", "responseId": "degraded-realtime" },
  "tags": ["p1_wave1e", "p1_ready", "matrix_2"],
  "invariantAssertions": [
    "valid_itinerary_structure",
    "origin_destination_consistency",
    "chronological_legs",
    "nonnegative_durations",
    "satisfaction_accounting",
    "complete_beats_partial",
    "max_satisfaction_before_time",
    "deterministic_order",
    "max_three_itineraries",
    "honest_data_mode",
    "impossible_constraint_explanation",
    "expected_feasibility",
    "minimum_satisfaction"
  ]
}
