{
  "caseId": "bmc-recorded-partial-agl-hoyt-1av",
  "title": "Recorded: Hoyt–Schermerhorn → 1 Av A+G+L partial (A omitted)",
  "classification": "recorded_data",
  "categories": [
    "borough_brooklyn",
    "borough_manhattan",
    "cross_borough",
    "lines_3",
    "transfer",
    "incompatible_lines",
    "impossible_constraint",
    "degraded_realtime"
  ],
  "origin": { "placeId": "st:A42" },
  "destination": { "placeId": "st:L06" },
  "timing": { "type": "depart_now" },
  "selectedLineIds": ["A", "G", "L"],
  "expectedFeasibility": "partial",
  "minimumSatisfactionCount": 2,
  "humanReviewNotes": "Captured 2026-07-30 :8080. Best path uses G+L; omittedLineIds names A. static=mta-subway-c9c3366cdd16; dataMode=stale. Multi-line partial with named omission.",
  "staticDatasetVersion": "mta-subway-c9c3366cdd16",
  "realtimeFixtureVersion": "rt_live_20260730_1c24a8f3d2",
  "sut": {
    "kind": "recorded_response",
    "responseId": "recorded-partial-agl-hoyt-1av"
  },
  "tags": ["nyc_live_capture", "named_omission"],
  "invariantAssertions": [
    "valid_itinerary_structure",
    "origin_destination_consistency",
    "chronological_legs",
    "nonnegative_durations",
    "satisfaction_accounting",
    "complete_beats_partial",
    "max_satisfaction_before_time",
    "deterministic_order",
    "max_three_itineraries",
    "honest_data_mode",
    "impossible_constraint_explanation",
    "expected_feasibility",
    "minimum_satisfaction"
  ]
}
