{
  "caseId": "bmc-p1-alpha-midtown-penn-72",
  "title": "LIVE WATCH: Grand Central→Penn preferred 7+2 uses prefs when feasible",
  "classification": "pending_live_integration",
  "categories": ["borough_manhattan", "lines_2", "transfer"],
  "origin": { "placeId": "st:723" },
  "destination": { "placeId": "st:128" },
  "timing": { "type": "depart_now" },
  "selectedLineIds": ["7", "2"],
  "expectedFeasibility": "complete",
  "minimumSatisfactionCount": 1,
  "humanReviewNotes": "Controlled-alpha live watch. Public station PlaceRefs make the case executable with the address flag off. A 2-of-2 route is topologically feasible via Times Sq; the certified alpha currently returns 1-of-2, so this remains soft until the Stage C routing candidate is deployed and recertified.",
  "staticDatasetVersion": "mta-subway-pending",
  "realtimeFixtureVersion": "live_at_gate_time",
  "sut": { "kind": "live", "responseId": "live-p1-midtown-penn-72" },
  "tags": ["p1_wave1e", "p1_pending", "alpha_regression", "soft_feasibility", "stage_c_watch", "privacy_safe_placeref"],
  "invariantAssertions": [
    "valid_itinerary_structure",
    "chronological_legs",
    "nonnegative_durations",
    "satisfaction_accounting",
    "deterministic_order",
    "max_three_itineraries",
    "honest_data_mode",
    "expected_feasibility",
    "minimum_satisfaction"
  ]
}
