{
  "caseId": "bmc-pending-manhattan-l-only",
  "title": "PENDING: 8 Av → Bedford Av L mid-day",
  "classification": "pending_live_integration",
  "categories": [
    "borough_manhattan",
    "borough_brooklyn",
    "cross_borough",
    "off_peak",
    "lines_1",
    "od_on_selected_lines",
    "no_transfer"
  ],
  "origin": {
    "stationId": "st_8av_l"
  },
  "destination": {
    "stationId": "st_bedford_l"
  },
  "timing": {
    "type": "depart_at",
    "time": "2026-07-30T14:30:00-04:00"
  },
  "selectedLineIds": [
    "L"
  ],
  "expectedFeasibility": "complete",
  "minimumSatisfactionCount": 1,
  "humanReviewNotes": "Simple single-line OD on selected line; good smoke case for live integration.",
  "staticDatasetVersion": "gtfs_fixture_v1",
  "realtimeFixtureVersion": "rt_fixture_v1",
  "sut": {
    "kind": "conductor_fixture",
    "responseId": "degraded-realtime"
  },
  "tags": [
    "corpus_placeholder",
    "soft_feasibility"
  ],
  "invariantAssertions": [
    "valid_itinerary_structure",
    "chronological_legs",
    "nonnegative_durations",
    "complete_beats_partial",
    "max_satisfaction_before_time",
    "deterministic_order",
    "max_three_itineraries",
    "honest_data_mode"
  ]
}
